<?xml version="1.0" encoding="iso-8859-1"?>
<!--
    The schema for this namespace may be found at the following URL:

    http://www.blackperl.com/XML/ChangeLog/ChangeLogML.xsd

    $Id$
-->
<changelog xmlns="http://www.blackperl.com/XML/ChangeLog"
    xmlns:xsi="http://www.w3.org/2001/XMLSchema-instance"
    xsi:schemaLocation="http://www.blackperl.com/XML/ChangeLog etc/ChangeLogML.xsd">
  <description>
    Revision history for the Perl extension module WebService::ISBNDB. This is
    an API to communicate with the web service hosted by isbndb.com.
  </description>
  <release version="0.12" tag="v0_12" date="2006-09-14T03:11:29-06:00">
    <change>
      <fileset>
        <file path="lib/Net" action="DELETE" revision="11" />
        <file path="lib/WebService" action="ADD" revision="11" />
      </fileset>
      <description>
        Renamed lib/Net to lib/WebService.
      </description>
    </change>
    <change>
      <fileset>
        <file path="lib/WebService/ISBNDB/API.pm" revision="12" />
        <file path="lib/WebService/ISBNDB/Agent.pm" revision="12" />
        <file path="lib/WebService/ISBNDB/API/Books.pm" revision="12" />
        <file path="lib/WebService/ISBNDB/API/Publishers.pm" revision="12" />
        <file path="lib/WebService/ISBNDB/API/Subjects.pm" revision="12" />
        <file path="lib/WebService/ISBNDB/API/Categories.pm" revision="12" />
        <file path="lib/WebService/ISBNDB/API/Authors.pm" revision="12" />
        <file path="lib/WebService/ISBNDB/Agent/REST.pm" revision="12" />
        <file path="MANIFEST" revision="12" />
      </fileset>
      <description>
        Change all file-references and class-references from Net to
	WebService.
      </description>
    </change>
    <change>
      <file path="t/00_load.t" revision="13" />
      <description>
        Change all file-references and class-references from Net to
	WebService.
      </description>
    </change>
    <change>
      <fileset>
        <file path="Build.PL" revision="14" />
        <file path="MANIFEST" revision="14" />
        <file path="MANIFEST.SKIP" revision="14" />
        <file path="Makefile.PL" revision="14" />
      </fileset>
      <description>
        Changed the build controller from ExtUtils::MakeMaker to
        Module::Build, and put in a compatibility layer for EU::MM.
        Added Build.PL to MANIFEST and some more elements to MANIFEST.SKIP.
      </description>
    </change>
  </release>
  <release version="0.11" tag="v0_11" date="2006-09-13T02:11:00-06:00">
    <change>
      <fileset>
        <file path="ChangeLog" revision="9" />
        <file path="ChangeLog.xml" revision="9" />
        <file path="MANIFEST" revision="9" />
        <file path="README" revision="9" />
        <file path="Makefile.PL" revision="9" />
      </fileset>
      <description>
        The initial release omitted the changelog files and README from the
        manifest.
      </description>
    </change>
  </release>
  <release version="0.10" tag="v0_10" date="2006-09-13T01:15:06-06:00">
    <change>
      <fileset>
        <file path="ChangeLog" revision="5" />
        <file path="ChangeLog.xml" revision="7" />
        <file path="etc/ChangeLogML.xsd" revision="5" />
        <file path="lib/Net/ISBNDB/API.pm" revision="5" />
        <file path="lib/Net/ISBNDB/Agent.pm" revision="5" />
        <file path="lib/Net/ISBNDB/API/Books.pm" revision="5" />
        <file path="lib/Net/ISBNDB/API/Publishers.pm" revision="6" />
        <file path="lib/Net/ISBNDB/API/Subjects.pm" revision="6" />
        <file path="lib/Net/ISBNDB/API/Categories.pm" revision="6" />
        <file path="lib/Net/ISBNDB/API/Authors.pm" revision="6" />
        <file path="lib/Net/ISBNDB/Agent/REST.pm" revision="5" />
        <file path="Makefile.PL" revision="5" />
        <file path="MANIFEST" revision="5" />
        <file path="MANIFEST.SKIP" revision="5" />
        <file path="README" revision="5" />
        <file path="t/01_pod.t" revision="5" />
        <file path="t/02_pod_coverage.t" revision="5" />
        <file path="t/00_load.t" revision="5" />
        <file path="t/00_signature.t" revision="5" />
      </fileset>
      <description>
        Initial release.
      </description>
    </change>
  </release>
</changelog>
